,observation_guid,client_idcode,obscatalogmasteritem_displayname,observation_valuetext_analysed,observationdocument_recordeddtm,clientvisit_visitidcode,_id,_index,_score
0,obs_0,P545DUM23,AoMRC_ClinicalSummary_FT,Could cell spend capital bag discuss nature. Unit size hope police.,2021-01-05 23:01:11,visit_0,{i},{np.nan},{np.nan}
1,obs_1,P545DUM23,AoMRC_ClinicalSummary_FT,School get account management each hand. Court successful sea country hot gas participant. Station owner image guy able improve world.,2020-01-06 22:30:12,visit_1,{i},{np.nan},{np.nan}
2,obs_2,P545DUM23,AoMRC_ClinicalSummary_FT,Point contain plan soon her live. Whole beyond no public.,2023-01-20 22:15:04,visit_2,{i},{np.nan},{np.nan}
3,obs_3,P545DUM23,AoMRC_ClinicalSummary_FT,Newspaper best there right grow. Prove of upon try edge somebody those. Level science can likely.,2023-01-03 23:38:04,visit_3,{i},{np.nan},{np.nan}
4,obs_4,P545DUM23,AoMRC_ClinicalSummary_FT,Magazine design up. Not simple together shake small likely. So maintain break eat. Rule day concern enjoy book.,2023-01-07 18:58:03,visit_4,{i},{np.nan},{np.nan}
5,obs_5,P545DUM23,AoMRC_ClinicalSummary_FT,Green beat since. Traditional stop remain hotel it. Organization fear low book.,2020-01-20 06:46:56,visit_5,{i},{np.nan},{np.nan}
6,obs_6,P545DUM23,AoMRC_ClinicalSummary_FT,Dream part of list major it story. Its structure book sound should future. Human candidate rest bill radio lose.,2023-01-05 14:40:38,visit_6,{i},{np.nan},{np.nan}
7,obs_7,P545DUM23,AoMRC_ClinicalSummary_FT,Chance suddenly fund water him along information. Employee point young role age agent administration.,2021-01-27 07:37:33,visit_7,{i},{np.nan},{np.nan}
